{
  "schema_version": 1,
  "benchmark": {
    "actions": 5,
    "cheap_noise": 0.25,
    "accurate_noise": 0.03,
    "bias_scale": 0.35,
    "cheap_cost": 1.0,
    "accurate_cost": 12.0,
    "cheap_tokens": 16,
    "accurate_tokens": 96
  },
  "run": {
    "repetitions": 100,
    "base_seed": 41
  },
  "budget": {
    "max_cost": 65.0,
    "max_tokens": 560,
    "max_accurate_calls": 5,
    "max_iterations": 100
  },
  "methods": [
    "cheap_only",
    "accurate_only",
    "fixed_cascade",
    "adaptive"
  ],
  "planner_settings": {
    "fixed_cascade": {
      "top_k": 2
    },
    "adaptive": {
      "z_score": 1.64
    }
  }
}
